{
  "type": "sound",
  "id": "chime-pack",
  "name": "Chime Pack",
  "version": "1.0.0",
  "author": {
    "name": "MioIsland Team"
  },
  "price": 0,
  "description": "Gentle chime notification sounds",
  "tags": ["chime", "notification", "gentle"],
  "preview": "preview.png",
  "category": "notification",
  "sounds": {
    "session_start": "sounds/start.m4a",
    "needs_approval": "sounds/approval.m4a",
    "session_complete": "sounds/complete.m4a",
    "error": "sounds/error.m4a"
  }
}
